Sheet: Quote
A1: Numero de Parte | B1: Descripción | C1: Precio de Lista | D1: Cant. | E1: Descuento | F1: Intro | G1: Margen | H1: Precio de Venta | I1: Sub-Total
A2: Hardware
A3: MR32-HW | B3: Meraki MR32 Cloud Managed | C3: 799 | D3: 1 | E3: 0.2 | F3: 0.2 | G3: 0.2 | H3: =RC[-5]*(1-RC[-3])*(1+RC[-2])/(1-RC[-1]) -> 958.80000000000007 | I3: =RC[-1]*RC[-5] -> 958.80000000000007
A4: MS220-24-HW | B4: Meraki MS220-24 L2 Cloud Managed 24 Port GigE Switch | C4: 2155 | D4: 2 | E4: 0.2 | F4: 0.2 | G4: 0.2 | H4: =RC[-5]*(1-RC[-3])*(1+RC[-2])/(1-RC[-1]) -> 2585.9999999999995 | I4: =RC[-1]*RC[-5] -> 5171.9999999999991
A5: Software
A6: LIC-ENT-3YR | B6: Meraki MR Enterprise License, 3 Years | C6: 300 | D6: 1 | E6: 0.2 | F6: 0 | G6: 0.2 | H6: =RC[-5]*(1-RC[-3])*(1+RC[-2])/(1-RC[-1]) -> 300 | I6: =RC[-1]*RC[-5] -> 300
A7: LIC-MS220-24-3YR | B7: Meraki MS220-24 Enterprise License and Support, 3 Year | C7: 240 | D7: 1 | E7: 0.2 | F7: 0 | G7: 0.2 | H7: =RC[-5]*(1-RC[-3])*(1+RC[-2])/(1-RC[-1]) -> 240 | I7: =RC[-1]*RC[-5] -> 240
A8: Administracíón, Soporte y Financiación
A9: Servicio | B9: Cuota mensual | C9: 3.7 | D9: - | E9: - | F9: - | G9: 0.5 | H9: - | I9: =RC[-6]/(1-RC[-2]) -> 7.4
A10: Administracion | B10: Cuota mensual | C10: 16.920000000000002 | D10: - | E10: - | F10: - | G10: 0.5 | H10: - | I10: =RC[-6]/(1-RC[-2]) -> 33.840000000000003
A11: Financiación de Equipos | B11: Cuota mensual bajo contrato a 36 meses | C11: - | D11: - | E11: 0.2 | F11: - | G11: 0.2 | H11: - | I11: 47.94
B13: Solución Unificada
B14: Cuota Mensual | C14: =SUM(R[-5]C[6]:R[-3]C[6]) -> 89.18
B15: OBS: Contrato a 36 meses obligatorio.
B17: Soulción Administrada
B18: Inversión Inicial | C18: =SUM(R[-15]C[6]) -> 958.80000000000007
B19: Cuota mensual | C19: =R[-10]C[6]+R[-9]C[6]+SUM(R[-13]C[6]:R[-12]C[6])/36 -> 56.24
B21: Solución Tradicional
B22: Inversión Inicial | C22: =SUM(R[-19]C[6]) -> 958.80000000000007
B23: Cuota mensual | C23: =R[-14]C[6]+SUM(R[-17]C[6]:R[-16]C[6])/36 -> 22.4